[
  {
    "tenant_id": "tenant-a",
    "service": "payment-api",
    "environment": "sandbox",
    "region": "us-east-1",
    "timestamp": "2026-06-22T09:58:00Z",
    "source": "github-actions",
    "version": "v1.2.3",
    "deployed_by": "ci",
    "change_summary": "changed redis connection pool config",
    "rollback_ref": "v1.2.2",
    "labels": {"pipeline": "payment-api-deploy"}
  }
]
